<?xml version="1.0" encoding="UTF-8"?>
<ListCustomers xsi:noNamespaceSchemaLocation="/home/developer/workspaceTraining/UC2/src/main/resources/schemas/customers.xsd" xmlns:xsi="http://www.w3.org/2001/XMLSchema-instance">
       <customer  type="user">
              <name>John</name>
              <address>King's st.</address>
              <email>John@king.st</email>
              <country>UK</country>
          </customer>
       <customer  type="partner">
              <name>A</name>
              <address>5th av.</address>
              <email>a@5th.av</email>
              <country>US</country>
          </customer>
       <customer type="user">
              <name>Lucy</name>
              <address>Newcourt St.</address>
              <email>lucy@newcourt.st</email>
              <country>UK</country>
          </customer>
   </ListCustomers>
